{
  "$schema": "https://json-schema.org/draft/2020-12/schema",
  "$id": "docs/contracts/ai-decision-record.schema.json",
  "title": "AI Decision Record v1",
  "type": "object",
  "additionalProperties": false,
  "required": [
    "run_id",
    "symbol",
    "market",
    "cadence",
    "asof_date",
    "prompt_version",
    "schema_version",
    "model_label",
    "input_summary",
    "decision",
    "validation"
  ],
  "properties": {
    "run_id": {
      "type": "string",
      "minLength": 1
    },
    "symbol": {
      "type": "string",
      "minLength": 1
    },
    "market": {
      "type": "string",
      "minLength": 1
    },
    "cadence": {
      "type": "string",
      "minLength": 1
    },
    "asof_date": {
      "type": "string",
      "format": "date"
    },
    "prompt_version": {
      "type": "string",
      "minLength": 1
    },
    "schema_version": {
      "type": "string",
      "minLength": 1
    },
    "model_label": {
      "type": "string",
      "minLength": 1
    },
    "input_summary": {
      "type": "object",
      "additionalProperties": false,
      "required": ["snapshot_ref", "snapshot_hash"],
      "properties": {
        "snapshot_ref": {
          "type": "string",
          "minLength": 1
        },
        "snapshot_hash": {
          "type": "string",
          "minLength": 1
        },
        "summary_text": {
          "type": "string"
        }
      }
    },
    "decision": {
      "$ref": "docs/contracts/ai-decision-output.schema.json"
    },
    "validation": {
      "type": "object",
      "additionalProperties": false,
      "required": ["status"],
      "properties": {
        "status": {
          "type": "string",
          "enum": ["passed", "blocked"]
        },
        "validated_at": {
          "type": "string",
          "format": "date-time"
        },
        "issues": {
          "type": "array",
          "items": {
            "type": "string"
          }
        }
      }
    }
  }
}
